{
  "$schema": "https://json-schema.org/draft/2020-12/schema",
  "$id": "https://sdv-test-framework/schemas/scenario.schema.json",
  "title": "SDV Test Framework Scenario",
  "type": "object",
  "required": ["name", "steps"],
  "properties": {
    "name": { "type": "string", "minLength": 1 },
    "fixture": { "type": "string" },
    "mods": { "type": "array", "items": { "type": "string" } },
    "config": {
      "type": "object",
      "properties": {
        "seed": { "type": "integer" },
        "zoom": { "type": "number" },
        "resolution": {
          "type": "array",
          "items": { "type": "integer" },
          "minItems": 2,
          "maxItems": 2
        }
      },
      "additionalProperties": false
    },
    "steps": {
      "type": "array",
      "items": {
        "oneOf": [
          {
            "type": "object",
            "required": ["action"],
            "properties": {
              "action": {
                "type": "string",
                "minLength": 1,
                "description": "Scenario step action. Unknown actions are invoked as RPC methods, including player.set_transient_state, fishing.sample_catch, and world.place_object for ad hoc probes."
              },
              "args": { "type": "object" }
            },
            "additionalProperties": false
          },
          {
            "type": "object",
            "required": ["include"],
            "properties": {
              "include": { "type": "string", "minLength": 1 }
            },
            "additionalProperties": false
          }
        ]
      }
    },
    "assertions": {
      "type": "array",
      "items": {
        "type": "object",
        "required": ["type"],
        "properties": {
          "type": {
            "type": "string",
            "description": "Assertion kind. Supported RPC-result assertions include state.fishing_context, state.fishing_table, and fishing.sample_catch."
          },
          "expr": { "type": "string" },
          "asset": { "type": "string", "minLength": 1 },
          "asset_type": {
            "type": "string",
            "enum": ["map", "texture", "data", "string", "unknown"]
          },
          "include_keys": { "type": "boolean" },
          "keys_limit": { "type": "integer", "minimum": 1, "maximum": 500 },
          "entry_keys": {
            "type": "array",
            "items": { "type": "string", "minLength": 1 }
          },
          "hash_texture": { "type": "boolean" },
          "filter": { "type": "object" },
          "params": {
            "type": "object",
            "description": "Optional params passed to RPC-backed assertion types such as state.fishing_table or state.player."
          },
          "min_count": { "type": "integer", "minimum": 1 },
          "max_count": { "type": "integer", "minimum": 1 },
          "message": { "type": "string" },
          "baseline": { "type": "string" },
          "tolerance": {
            "type": "number",
            "description": "Threshold; semantics depend on method. SSIM: float in (0, 1] (higher = stricter). pixel-exact: int >= 0 (max RGB channel delta allowed). dhash: int in [0, 64] (Hamming distance allowed)."
          },
          "method": {
            "type": "string",
            "enum": ["ssim", "pixel-exact", "dhash"],
            "description": "Diff method. Default 'ssim'."
          },
          "tier": {
            "type": "string",
            "enum": ["generic", "ci-ubuntu", "self-hosted-nvidia"],
            "description": "Per-assertion tier override of the run-wide --tier flag. Optional."
          },
          "region": {
            "type": "object",
            "required": ["x", "y", "w", "h"],
            "properties": {
              "x": { "type": "integer", "minimum": 0 },
              "y": { "type": "integer", "minimum": 0 },
              "w": { "type": "integer", "minimum": 1 },
              "h": { "type": "integer", "minimum": 1 }
            },
            "additionalProperties": false
          },
          "diff_format": {
            "type": "string",
            "enum": ["files", "triptych", "all"],
            "description": "Per-assertion override of the run-wide --diff-format flag. Optional."
          }
        }
      }
    }
  },
  "additionalProperties": false
}
